{
  "_doc": "Config específica desta LP. Skill lp-armazem clona este arquivo + assets ao gerar LP nova. Conteúdo genérico (Trust/Why/FAQ/Testi/Footer) fica em data.jsx (compartilhado com futuras LPs de bico-injetor).",

  "slug": "amarok-bico-injetor",
  "categoria": "bico-injetor",
  "veiculo_key": "amarok",

  "veiculo": {
    "marca_aliases": ["VOLKSWAGEN", "VW"],
    "modelo_aliases": ["AMAROK"],
    "motor_por_cv": {
      "122": "2.0 TDI Diesel",
      "140": "2.0 TDI Diesel",
      "163": "2.0 TDI Diesel",
      "180": "2.0 BiTDI Diesel",
      "224": "3.0 V6 TDI Diesel",
      "258": "3.0 V6 TDI Diesel"
    }
  },

  "hero": {
    "eyebrow": "COMPRA SEGURA. ENTREGA GARANTIDA.",
    "h1_linha1": "BICO INJETOR",
    "h1_linha2": "AMAROK",
    "h1_sub": "Original ou primeira linha",
    "sub": "Para Amarok 2.0 TDI e 3.0 V6.",
    "foto_static": "assets/amarok-static.webp",
    "foto_dust": "assets/amarok-dust.webp",
    "foto_alt": "VW Amarok preta em ângulo lateral",
    "bg_position_mobile": "50% 50%",
    "bg_position_desktop": "62% center",
    "cta_mobile_label": "Achar o bico certo"
  },

  "selector": {
    "titulo_l1": "Encontre o bico certo",
    "titulo_l2": "pro seu veículo",
    "subtexto": "Consultamos FIPE/Denatran pra você comprar a peça certa."
  },

  "peca": {
    "nome": "BICO INJETOR BOSCH",
    "short_label": "BICO BOSCH",
    "fabricante_label": "OEM BOSCH",
    "fabricante_principal_short": "Bosch",
    "fabricantes_aceitos": ["Bosch"],
    "foto_default": "assets/bico-bosch-caixa.webp",
    "foto_alt": "Bico injetor Bosch original na caixa",
    "tem_primeira_linha": true,
    "v6_disponibilidade_limitada": true,
    "equivalentes_por_motor": {
      "2.0 TDI": ["0445110646", "0445110647", "0986435166", "03L130277J", "03L130277Q"],
      "3.0 V6 TDI": ["0445117084", "059130277FC"]
    },
    "bullets_default": [
      "Peça original de fábrica",
      "Garantia Bosch",
      "Pronta entrega de Chapecó/SC"
    ],
    "bullets_v6": [
      "Peça original motor V6",
      "Garantia Bosch",
      "Disponibilidade limitada — consulte estoque"
    ],
    "bullets_unknown": [
      "Peça compatível com seu veículo",
      "Entrega de Chapecó/SC pra todo Brasil",
      "Garantia de fábrica + Armazém"
    ]
  },

  "result_messages": {
    "default_oem_unknown": "Consulte no WhatsApp",
    "hint_primeira_linha_bold": "Também temos versão primeira linha",
    "hint_primeira_linha_tail": "com preço mais acessível. Consulte no WhatsApp.",
    "not_supported_default": "Esta LP é específica para VW Amarok. Fale com a gente no WhatsApp pra consultar peças do seu veículo."
  },

  "wa": {
    "hero_link": "Olá, quero falar com um vendedor sobre bico injetor pra Amarok.",
    "fab_default": "Olá, cheguei pela landing page e quero falar sobre bico injetor pra Amarok.",
    "result_plate_template": "Olá, consultei a placa {plate} na landing page e vi o bico injetor {oem} pra minha {modelo} {ano} {motor}. Quero cotar.",
    "result_year_template": "Olá, quero cotar o bico injetor {oem} pra Amarok {year} {motor}.",
    "result_dontknow_motor": "Olá, não sei qual é o motor da minha Amarok. Podem me ajudar?",
    "result_notfound_template": "Olá, tentei buscar {query} na landing page e não encontrou. Podem me ajudar?",
    "result_notsupported_template": "Olá, consultei {query} na landing page Amarok e meu veículo é {ident}. Podem me ajudar a encontrar a peça?",
    "result_error_template": "Olá, tentei consultar {query} na landing page e deu erro. Podem me ajudar?",
    "final_cta": "Olá, quero falar com o vendedor sobre bico injetor pra Amarok."
  },

  "why": {
    "h2_l1": "Bico injetor é segurança.",
    "h2_l2": "Escolha errada",
    "h2_l2_red": "custa caro",
    "items": [
      {
        "num": "01",
        "ttl": "Compatibilidade que não erra.",
        "body": "Nosso sistema cruza sua placa com FIPE/Denatran. Você compra o bico certo pro motor certo, no ano certo. Sem achismo, sem telefone trocado, sem peça voltando."
      },
      {
        "num": "02",
        "ttl": "A marca que o fabricante recomenda.",
        "body": "Bosch — a mesma marca montada de fábrica na sua Amarok, com código OEM confirmado. Quando disponível, também oferecemos versão primeira linha de qualidade equivalente, com garantia."
      },
      {
        "num": "03",
        "ttl": "Voltamos a rodar no mesmo dia.",
        "body": "Estoque em Chapecó/SC. Saída direta pra transportadora no mesmo dia útil da confirmação. Sua Amarok não fica parada esperando peça."
      }
    ]
  },

  "final_cta": {
    "h2_l1": "Pronto pra",
    "h2_l2_red_l1": "voltar",
    "h2_l2_red_l2": "a rodar",
    "sub_pre": "Insira sua placa no",
    "sub_anchor": "seletor acima",
    "sub_post": "ou chame direto no WhatsApp.",
    "btn": "Falar com o vendedor agora",
    "microtext_pre": "WhatsApp",
    "microtext_post": "— resposta em minutos, de segunda a sexta."
  },

  "seo": {
    "title": "Bico Injetor Amarok — Armazém Auto Peças",
    "description": "Bico injetor Bosch original ou primeira linha para VW Amarok 2.0 TDI e 3.0 V6. Identificamos seu motor pela placa ou chassi. Compra segura.",
    "og_image": "assets/amarok-static.png",
    "og_image_alt": "VW Amarok preta em ângulo frontal",
    "twitter_description": "Bico injetor Bosch original ou primeira linha para VW Amarok 2.0 TDI e 3.0 V6.",
    "canonical_path": "/amarok-bico-injetor/",
    "product": {
      "name": "Bico Injetor Bosch para VW Amarok 2.0 TDI e 3.0 V6",
      "description": "Bico injetor original Bosch ou primeira linha para VW Amarok 2.0 TDI (140cv/163cv/180cv Biturbo) e 3.0 V6 TDI (224cv/258cv), anos 2010-2024. Código OEM confirmado por consulta FIPE/Denatran.",
      "brands": ["Bosch"],
      "vehicles": [
        "Volkswagen Amarok 2.0 TDI",
        "Volkswagen Amarok 3.0 V6 TDI"
      ]
    }
  }
}
